{
  "schemaVersion": 1,
  "templateVersion": "1.0.0",
  "status": "structure-approved",
  "compatiblePipelineVersion": "1.0.0-draft.1",
  "references": {
    "global": {
      "path": "docs/characters/pipeline-config.json",
      "schemaVersion": 1,
      "sha256": "be3feb5e118f0f9598385cfd1c5b5e68c22a3980f0749e5aa18e8227864afc2d"
    },
    "semantics": {
      "path": "docs/characters/pose-semantics.json",
      "schemaVersion": 1,
      "sha256": "e050421ebafb05f1c983f9445895a4bb522b804e9a967df82992595af91b6359"
    },
    "geometry": {
      "path": "docs/characters/geometry-profile.json",
      "schemaVersion": 1,
      "sha256": "407afe4a28ebc20c11d6e584ffdc93cc2f3a265d301d196b50a23002e81a4f95"
    }
  },
  "authoringConvention": {
    "laterality": "anatomical",
    "lead": "left",
    "executor": "right",
    "lateralVariants": "explicit-character-instance",
    "facingMirror": "preserve-anatomical-ids"
  },
  "rootPolicy": {
    "actorOrigin": "geometry-profile-pivot-only",
    "additionalActorTransform": false,
    "neutralPelvisReference": "per-character-anatomical-reference",
    "aerialPelvis": "shared-neutral-pelvis-reference",
    "aerialResources": ["base_07", "base_22", "base_23"],
    "worldTrajectory": "simulation-only",
    "groundContacts": "surface-points-at-nominal-ground",
    "lyingPlacement": "relative-to-character-pelvis-reference-no-bounds-centering",
    "surfaceContactsAreLandmarkCenters": false
  },
  "anatomyPolicy": {
    "owner": "character-spec",
    "perPoseScale": false,
    "fitCellByScaling": false,
    "overflow": "report-for-review",
    "landmarkCoordinates": "character-instance-only",
    "anatomicalTolerancePercent": null
  },
  "walk": {
    "sequence": [
      {
        "resourceId": "base_04",
        "phase": "left-contact"
      },
      {
        "resourceId": "base_05",
        "phase": "left-passing"
      },
      {
        "resourceId": "base_06",
        "phase": "right-contact"
      }
    ],
    "unstoredTransition": {
      "phase": "right-passing",
      "resourceId": null,
      "supportLeg": "right",
      "swingLeg": "left",
      "hands": {
        "left": "relaxed",
        "right": "relaxed"
      },
      "groundContacts": [
        {
          "site": "right_foot",
          "surface": "sole",
          "supportsWeight": true
        }
      ]
    },
    "loopTo": "base_04",
    "interpolation": "articulated-constant-segment-lengths-with-planted-contact",
    "runtimeAnimationChange": false
  },
  "mannequin": {
    "derivation": ["character-proportions", "base-movement-template"],
    "generationInputs": [
      "character-spec",
      "master-character-reference",
      "pose-definition",
      "parametric-mannequin",
      "skeleton-landmarks"
    ],
    "universalMorphology": false,
    "expectedControlOutputs": [
      {
        "kind": "neutral-volume-reference",
        "coordinateSpace": "canonical-frame",
        "requiredAnnotations": [
          "character-and-template-version",
          "shared-camera-reference",
          "no-character-identity-or-clothing"
        ]
      },
      {
        "kind": "anatomical-skeleton-landmarks",
        "coordinateSpace": "canonical-frame",
        "requiredAnnotations": [
          "22-anatomical-landmark-ids",
          "authored-not-measured",
          "character-proportions-reference",
          "lateral-variant"
        ]
      },
      {
        "kind": "root-ground-surface-contact-overlay",
        "coordinateSpace": "canonical-frame",
        "requiredAnnotations": [
          "P04-pivot",
          "nominal-ground",
          "neutral-pelvis-reference",
          "surface-contacts-separate-from-joint-centers"
        ]
      },
      {
        "kind": "visibility-and-depth-order",
        "coordinateSpace": "shared-camera",
        "requiredAnnotations": [
          "front-back-limb-order",
          "palms-orientation",
          "visible-occluded-unknown",
          "projection-reference"
        ]
      },
      {
        "kind": "constraint-validation-report",
        "coordinateSpace": "not-applicable",
        "requiredAnnotations": [
          "structural-rules",
          "allowed-variations",
          "pending-measurements",
          "P04-margins-and-overflow"
        ]
      }
    ],
    "camera": {
      "sharedAcrossPoses": true,
      "status": "pending-visual-validation",
      "projection": null,
      "parameters": null
    },
    "assetsGenerated": false,
    "characterInputs": {
      "anatomy": "characterSpec.visual.proportions",
      "stature": "characterSpec.visual.statureGameUnits",
      "appearanceReference": "characterSpec.visual.masterReferencePath",
      "neutralPelvisReference": "movement-template-instance.neutralPelvisReference"
    },
    "segmentLengths": "constant-across-poses-derived-from-character-proportions",
    "occludedLandmarks": "authored-control-geometry-is-not-observed-image-evidence"
  },
  "poses": [
    {
      "resourceId": "base_01",
      "intent": "balanced-guard",
      "family": "guard",
      "structure": {
        "torso": "upright-three-quarter",
        "headPelvis": "above-pelvis-forward",
        "arms": "guard",
        "legs": "flexed-stance",
        "load": "balanced",
        "executor": "none",
        "direction": "neutral",
        "hands": {
          "left": "fist",
          "right": "fist"
        },
        "supportLeg": "both",
        "airborne": false,
        "contacts": [
          {
            "site": "left_foot",
            "surface": "sole",
            "supportsWeight": true
          },
          {
            "site": "right_foot",
            "surface": "sole",
            "supportsWeight": true
          }
        ],
        "pelvisRelation": "relative-to-neutral"
      },
      "structuralDescription": "Peso equilibrado; puño izquierdo delante del pecho y derecho junto a mejilla; rodillas disponibles.",
      "criticalLandmarks": [
        "head_center",
        "neck",
        "sternum",
        "pelvis_center",
        "left_shoulder",
        "left_elbow",
        "left_wrist",
        "left_palm",
        "right_shoulder",
        "right_elbow",
        "right_wrist",
        "right_palm"
      ],
      "variableLandmarks": [
        "left_hip",
        "left_knee",
        "left_ankle",
        "left_heel",
        "left_toe",
        "right_hip",
        "right_knee",
        "right_ankle",
        "right_heel",
        "right_toe"
      ],
      "allowedVariations": [
        {
          "parameter": "guard-spacing",
          "condition": "Conservar intención, topología articular, manos, apoyos y longitudes corporales del Character Spec."
        },
        {
          "parameter": "stance-width",
          "condition": "Variar separación sin cambiar contactos, pierna de apoyo, raíz ni longitudes anatómicas."
        }
      ],
      "coordinateStatus": "character-instance-pending"
    },
    {
      "resourceId": "base_02",
      "intent": "compact-guard",
      "family": "guard",
      "structure": {
        "torso": "upright-three-quarter",
        "headPelvis": "above-pelvis-forward",
        "arms": "compact-guard",
        "legs": "flexed-stance",
        "load": "balanced",
        "executor": "none",
        "direction": "neutral",
        "hands": {
          "left": "fist",
          "right": "fist"
        },
        "supportLeg": "both",
        "airborne": false,
        "contacts": [
          {
            "site": "left_foot",
            "surface": "sole",
            "supportsWeight": true
          },
          {
            "site": "right_foot",
            "surface": "sole",
            "supportsWeight": true
          }
        ],
        "pelvisRelation": "relative-to-neutral"
      },
      "structuralDescription": "Codos próximos al torso y manos más centrales que 01; conservar base de apoyo.",
      "criticalLandmarks": [
        "head_center",
        "neck",
        "sternum",
        "pelvis_center",
        "left_shoulder",
        "left_elbow",
        "left_wrist",
        "left_palm",
        "right_shoulder",
        "right_elbow",
        "right_wrist",
        "right_palm"
      ],
      "variableLandmarks": [
        "left_hip",
        "left_knee",
        "left_ankle",
        "left_heel",
        "left_toe",
        "right_hip",
        "right_knee",
        "right_ankle",
        "right_heel",
        "right_toe"
      ],
      "allowedVariations": [
        {
          "parameter": "guard-spacing",
          "condition": "Conservar intención, topología articular, manos, apoyos y longitudes corporales del Character Spec."
        },
        {
          "parameter": "stance-width",
          "condition": "Variar separación sin cambiar contactos, pierna de apoyo, raíz ni longitudes anatómicas."
        }
      ],
      "coordinateStatus": "character-instance-pending"
    },
    {
      "resourceId": "base_03",
      "intent": "exploratory-guard",
      "family": "guard",
      "structure": {
        "torso": "upright-three-quarter",
        "headPelvis": "above-pelvis-forward",
        "arms": "exploratory-guard",
        "legs": "flexed-stance",
        "load": "balanced",
        "executor": "none",
        "direction": "neutral",
        "hands": {
          "left": "fist",
          "right": "fist"
        },
        "supportLeg": "both",
        "airborne": false,
        "contacts": [
          {
            "site": "left_foot",
            "surface": "sole",
            "supportsWeight": true
          },
          {
            "site": "right_foot",
            "surface": "sole",
            "supportsWeight": true
          }
        ],
        "pelvisRelation": "relative-to-neutral"
      },
      "structuralDescription": "Antebrazo izquierdo explora delante sin extenderse como golpe; derecha protege mejilla.",
      "criticalLandmarks": [
        "head_center",
        "neck",
        "sternum",
        "pelvis_center",